{
  "checks": {
    "ansible_port_8081": true,
    "docker_token_in_page": false,
    "docker_tokenproof": false,
    "jenkins_pipeline_has_stages": false,
    "security_db_has_tables": false
  },
  "evidence_sha256": {
    "ansible_hello": "e3b0c44298fc1c149afbf4c8996fb92427ae41e4649b934ca495991b7852b855",
    "ansible_ping": "e3b0c44298fc1c149afbf4c8996fb92427ae41e4649b934ca495991b7852b855",
    "ansible_playbook_install": "f5613fa610b3f8cf427569c272c2288c5dc07b15f8b9c52e9d5b3a5db8a8d583",
    "buildapp_console": "e3b0c44298fc1c149afbf4c8996fb92427ae41e4649b934ca495991b7852b855",
    "curl_apache_8081": "e3b0c44298fc1c149afbf4c8996fb92427ae41e4649b934ca495991b7852b855",
    "db_tables": "e3b0c44298fc1c149afbf4c8996fb92427ae41e4649b934ca495991b7852b855",
    "db_user_hash_sample": "e3b0c44298fc1c149afbf4c8996fb92427ae41e4649b934ca495991b7852b855",
    "docker_build_log": "e3b0c44298fc1c149afbf4c8996fb92427ae41e4649b934ca495991b7852b855",
    "docker_ps": "e3b0c44298fc1c149afbf4c8996fb92427ae41e4649b934ca495991b7852b855",
    "docker_sampleapp_curl": "e3b0c44298fc1c149afbf4c8996fb92427ae41e4649b934ca495991b7852b855",
    "docker_token_proof": "e3b0c44298fc1c149afbf4c8996fb92427ae41e4649b934ca495991b7852b855",
    "jenkins_docker_ps": "e3b0c44298fc1c149afbf4c8996fb92427ae41e4649b934ca495991b7852b855",
    "jenkins_url": "e3b0c44298fc1c149afbf4c8996fb92427ae41e4649b934ca495991b7852b855",
    "login_v1": "e3b0c44298fc1c149afbf4c8996fb92427ae41e4649b934ca495991b7852b855",
    "login_v2": "e3b0c44298fc1c149afbf4c8996fb92427ae41e4649b934ca495991b7852b855",
    "pipeline_console": "e3b0c44298fc1c149afbf4c8996fb92427ae41e4649b934ca495991b7852b855",
    "pipeline_script": "e3b0c44298fc1c149afbf4c8996fb92427ae41e4649b934ca495991b7852b855",
    "ports_conf_after": "8ee0ac8272eaa90ca6a9597cb472034768331e543d074cc72141b520ffb6f686",
    "signup_v1": "e3b0c44298fc1c149afbf4c8996fb92427ae41e4649b934ca495991b7852b855",
    "signup_v2": "e3b0c44298fc1c149afbf4c8996fb92427ae41e4649b934ca495991b7852b855",
    "testapp_console": "e3b0c44298fc1c149afbf4c8996fb92427ae41e4649b934ca495991b7852b855"
  },
  "generated_utc": "2026-03-20T14:46:30.911622+00:00",
  "run": {
    "platform": "linux",
    "python": "3.8.2"
  },
  "schema_version": "4.1",
  "student": {
    "group": "Ib-23-5B",
    "name": "Akhmetov Miras",
    "token": "D1-IB-23-5b-01-1A3F",
    "token_hash8": "4b0b5022"
  },
  "validation_passed": false
}
